{
  "$schema": "./manifest.schema.json",
  "lessonId": "fundamentos-teoria-01",
  "moduleId": "fundamentos-teoria",
  "order": 1,
  "title": "Vetores: a matéria-prima dos dados",
  "objective": "O aluno escreve vetor como lista ordenada, entende espaço vetorial ℝⁿ como conjunto fechado por soma e multiplicação por escalar, e descreve qualquer ponto/dado como combinação linear de vetores base.",
  "prerequisites": [],
  "sourceRefs": [
    "mml-2.4",
    "mml-2.5"
  ],
  "sourceFiles": [
    "mml/02-linear-algebra.md"
  ],
  "widget": "VectorSpaceWidget",
  "widgetConfig": {
    "space": "2d",
    "bases": [
      [
        1,
        0
      ],
      [
        0,
        1
      ]
    ],
    "availableOps": [
      "sum",
      "scale",
      "linearCombination"
    ]
  },
  "keyFormulas": [
    "\\boldsymbol{v} = \\sum_{i=1}^k \\lambda_i \\boldsymbol{x}_i",
    "\\boldsymbol{x} + \\boldsymbol{y} = (x_1 + y_1, \\dots, x_n + y_n)^\\top",
    "\\lambda \\boldsymbol{x} = (\\lambda x_1, \\dots, \\lambda x_n)^\\top"
  ],
  "numericExample": {
    "description": "Combinar linearmente: v = 2·(1,0) + 3·(0,1)",
    "inputs": {
      "c": [
        2,
        3
      ],
      "base": [
        [
          1,
          0
        ],
        [
          0,
          1
        ]
      ]
    },
    "expected": "v = (2, 3)",
    "expectedValues": [
      2,
      3
    ],
    "sourceRef": "mml-2.5"
  },
  "completionCriterion": "Na widget, o aluno monta um vetor alvo usando combinação linear e o sistema confirma que v = Σ cᵢ bᵢ.",
  "estimatedMinutes": 12,
  "status": "audited",
  "knownGaps": []
}
