{
  "$schema": "./manifest.schema.json",
  "lessonId": "fundamentos-aplicada-02",
  "moduleId": "fundamentos-aplicada",
  "order": 2,
  "title": "Treinando com gradiente descendente",
  "objective": "O aluno conecta o GD do curso 'teoria' ao MSE concreto, derivando manualmente ∂/∂θ₀ e ∂/∂θ₁ e vendo os dois parâmetros convergirem.",
  "prerequisites": [
    "fundamentos-teoria-06",
    "fundamentos-aplicada-01"
  ],
  "sourceRefs": [
    "mml-9.2",
    "mml-5.3"
  ],
  "sourceFiles": [
    "mml/09-linear-regression.md",
    "mml/05-derivatives-gradients.md"
  ],
  "widget": "LinearRegressionWidget",
  "widgetConfig": {
    "lr": 0.001,
    "thetaInit": [
      0,
      0
    ],
    "showLossCurve": true
  },
  "keyFormulas": [
    "\\frac{\\partial \\|\\boldsymbol{y} - \\boldsymbol{\\Phi}\\boldsymbol{\\theta}\\|_2^2}{\\partial \\boldsymbol{\\theta}} = -2(\\boldsymbol{y} - \\boldsymbol{\\Phi}\\boldsymbol{\\theta})^\\top \\boldsymbol{\\Phi} \\in \\mathbb{R}^{1 \\times D}",
    "\\mathcal{L}(\\boldsymbol{\\theta}) = \\frac{1}{2\\sigma^2} \\|\\boldsymbol{y} - \\boldsymbol{X}\\boldsymbol{\\theta}\\|^2"
  ],
  "numericExample": {
    "description": "Com X={1,2}, y={1,3}, lr=0.1, init θ₀=θ₁=0: os gradientes são -4.0 e -7.0 → θ = [0.4, 0.7] após 1 passo",
    "inputs": {
      "X": [
        1,
        2
      ],
      "y": [
        1,
        3
      ],
      "lr": 0.1,
      "init": [
        0,
        0
      ],
      "iterations": 1
    },
    "expected": "θ = [0.4, 0.7]",
    "expectedValues": [
      -4,
      -7,
      0.4,
      0.7
    ],
    "sourceRef": "mml-9.2"
  },
  "completionCriterion": "Na widget, ao rodar 100 épocas, a reta se ajusta aos dados e a curva de loss cai suavemente — student classifica \"convergiu\".",
  "estimatedMinutes": 15,
  "status": "draft",
  "knownGaps": []
}
